<?xml version="1.0"?>
<!DOCTYPE bank SYSTEM "hpe_cmd.dtd" >
<hpe>
	<namespace> br.ufc.hpe </namespace>
	<java>
		<value>java</value>
		<option>
			<cp>
				<value> -cp </value>
				<list>
					<argument>
						<type> lib </type>
						<cardinality>multiple</cardinality>
					</argument>
				</list>
			</cp>
		</option>
		<argument>
			<type> java-class </type>
			<cardinality>1</cardinality>
		</argument>
	</java>
</hpe>
 